{
  "apiVersion": "swarmkit/v1",
  "kind": "InstanceState",
  "workspace_id": "sterling-oms",
  "workspace_name": "Sterling OMS Project Workspace",
  "schema_version": "1.7.0",
  "generated_at": "2026-07-08T10:00:00Z",
  "artifacts": {
    "topologies": [
      {
        "id": "solution-design",
        "version": "1.0.0",
        "content_hash": "abcdef1234567890",
        "content": { "apiVersion": "swarmkit/v1", "kind": "Topology" }
      }
    ],
    "skills": [
      {
        "id": "get-weather",
        "version": "1.0.0",
        "content_hash": "deadbeef00000000",
        "content": { "apiVersion": "swarmkit/v1", "kind": "Skill" }
      }
    ],
    "archetypes": [],
    "triggers": []
  },
  "providers": ["anthropic", "deepseek"],
  "governance_provider": "mock",
  "health": { "status": "ok" }
}
